title,price,rating
Without Shame,"₹5,068.35",Five
Watchmen,"₹6,095.25",Four
Unlimited Intuition Now,"₹6,181.35",Four
Underlying Notes,"₹1,241.10",Two
The Shack,"₹2,943.15",One
The New Brand You: Your New Image Makes the Sale for You,"₹4,625.25",Five
"The Moosewood Cookbook: Recipes from Moosewood Restaurant, Ithaca, New York","₹1,295.70",Four
The Flowers Lied,"₹1,751.40",Two
"The Fabric of the Cosmos: Space, Time, and the Texture of Reality","₹5,870.55",One
The Book of Mormon,"₹2,579.85",Three
The Art and Science of Low Carbohydrate Living,"₹5,562.90",Five
The Alien Club,"₹5,712.00",One
Suzie Snowflake: One beautiful flake (a self-esteem story),"₹5,755.05",Five
Nap-a-Roo,"₹2,633.40",One
"NaNo What Now? Finding your editing process, revising your NaNoWriMo book and building a writing career through publishing and beyond","₹1,093.05",Four
Modern Day Fables,"₹4,981.20",Two
If I Gave You God's Phone Number....: Searching for Spirituality in America,"₹2,195.55",One
"Fruits Basket, Vol. 9 (Fruits Basket #9)","₹3,564.75",Four
Dress Your Family in Corduroy and Denim,"₹4,586.40",Three
Don't Forget Steven,"₹3,489.15",One
Chernobyl 01:23:40: The Incredible True Story of the World's Worst Nuclear Disaster,"₹3,771.60",Two
Art and Fear: Observations on the Perils (and Rewards) of Artmaking,"₹5,106.15",Four
A Shard of Ice (The Black Symphony Saga #1),"₹5,946.15",Three
A Hero's Curse (The Unseen Chronicles #1),"₹5,301.45",Three
23 Degrees South: A Tropical Tale of Changing Whether...,"₹3,757.95",Two
"Zero to One: Notes on Startups, or How to Build the Future","₹3,576.30",Three
Why Not Me?,"₹1,864.80",One
When Breath Becomes Air,"₹4,132.80",Two
Vagabonding: An Uncommon Guide to the Art of Long-Term World Travel,"₹3,878.70",Two
The Unlikely Pilgrimage of Harold Fry (Harold Fry #1),"₹4,580.10",Five
The New Drawing on the Right Side of the Brain,"₹4,517.10",Three
"The Midnight Assassin: Panic, Scandal, and the Hunt for America's First Serial Killer","₹2,987.25",Four
The Martian (The Martian #1),"₹4,345.95",Two
The High Mountains of Portugal,"₹5,370.75",One
The Grownup,"₹3,767.40",One
The E-Myth Revisited: Why Most Small Businesses Don't Work and What to Do About It,"₹3,875.55",One
South of Sunshine,"₹3,037.65",One
Smarter Faster Better: The Secrets of Being Productive in Life and Business,"₹4,083.45",Five
Silence in the Dark (Logan Point #4),"₹6,124.65",Three
Shadows of the Past (Logan Point #1),"₹4,165.35",Five
Roller Girl,"₹1,480.50",Five
Rising Strong,"₹2,291.10",Three
Proofs of God: Classical Arguments from Tertullian to Barth,"₹5,692.05",One
Please Kill Me: The Uncensored Oral History of Punk,"₹3,274.95",Four
Out of Print: City Lights Spotlight No. 14,"₹5,632.20",Five
My Life Next Door (My Life Next Door ),"₹3,820.95",Five
Miller's Valley,"₹6,146.70",Two
Man's Search for Meaning,"₹3,095.40",Three
"Love That Boy: What Two Presidents, Eight Road Trips, and My Son Taught Me About a Parent's Expectations","₹2,631.30",Two
Living Forward: A Proven Plan to Stop Drifting and Get the Life You Want,"₹1,317.75",Three
Les Fleurs du Mal,"₹3,049.20",Five
Left Behind (Left Behind #1),"₹4,275.60",Two
Kill 'Em and Leave: Searching for James Brown and the American Soul,"₹4,730.25",Five
Kierkegaard: A Christian Missionary to Christians,"₹4,948.65",One
John Vassos: Industrial Design for Modern Life,"₹2,123.10",Four
I'll Give You the Sun,"₹5,930.40",One
I Will Find You,"₹4,642.05",One
Hystopia: A Novel,"₹2,305.80",Four
Howl and Other Poems,"₹4,247.25",Two
History of Beauty,"₹1,080.45",Four
Heaven is for Real: A Little Boy's Astounding Story of His Trip to Heaven and Back,"₹5,550.30",Two
Future Shock (Future Shock #1),"₹5,843.25",Five
Ender's Game (The Ender Quintet #1),"₹4,582.20",One
Diary of a Citizen Scientist: Chasing Tiger Beetles and Other New Ways of Engaging the World,"₹2,983.05",One
Death by Leisure: A Cautionary Tale,"₹3,938.55",Four
Brilliant Beacons: A History of the American Lighthouse,"₹1,202.25",Three
Brazen: The Courage to Find the You That's Been Hiding,"₹2,018.10",Two
Between the World and Me,"₹5,975.55",Four
Being Mortal: Medicine and What Matters in the End,"₹5,781.30",Four
"A Murder Over a Girl: Justice, Gender, Junior High","₹1,386.00",Three
32 Yolks,"₹5,631.15",Two
"""Most Blessed of the Patriarchs"": Thomas Jefferson and the Empire of the Imagination","₹4,670.40",Five
You Are a Badass: How to Stop Doubting Your Greatness and Start Living an Awesome Life,"₹1,268.40",Three
Wildlife of New York: A Five-Borough Coloring Book,"₹2,324.70",Two
What Happened on Beale Street (Secrets of the South Mysteries #2),"₹2,663.85",Five
Unreasonable Hope: Finding Faith in the God Who Brings Purpose to Your Pain,"₹4,864.65",Two
Under the Tuscan Sun,"₹3,919.65",Three
Toddlers Are A**holes: It's Not Your Fault,"₹2,682.75",One
The Year of Living Biblically: One Man's Humble Quest to Follow the Bible as Literally as Possible,"₹3,645.60",One
The Whale,"₹3,775.80",Four
The Story of Art,"₹4,319.70",Four
The Origin of Species,"₹1,051.05",Four
The Great Gatsby,"₹3,785.25",Four
The Good Girl,"₹5,148.15",Three
The Glass Castle,"₹1,705.20",One
The Faith of Christopher Hitchens: The Restless Soul of the World's Most Notorious Atheist,"₹4,152.75",One
The Drowning Girls,"₹3,745.35",Three
The Constant Princess (The Tudor Court #1),"₹1,745.10",Three
The Bourne Identity (Jason Bourne #1),"₹4,491.90",Four
The Bachelor Girl's Guide to Murder (Herringford and Watts Mysteries #1),"₹5,491.50",Five
The Art Book,"₹3,395.70",Two
The 7 Habits of Highly Effective People: Powerful Lessons in Personal Change,"₹3,482.85",Four
Team of Rivals: The Political Genius of Abraham Lincoln,"₹2,112.60",Five
Steal Like an Artist: 10 Things Nobody Told You About Being Creative,"₹2,194.50",Two
"Sit, Stay, Love","₹2,194.50",Three
Sister Dear,"₹4,221.00",Four
"Shrunken Treasures: Literary Classics, Short, Sweet, and Silly","₹5,551.35",Three
"Rich Dad, Poor Dad","₹5,432.70",One
Raymie Nightingale,"₹3,613.05",Two
Playing from the Heart,"₹3,399.90",One
Nightstruck: A Novel,"₹5,286.75",Four
"Naturally Lean: 125 Nourishing Gluten-Free, Plant-Based Recipes--All Under 300 Calories","₹1,194.90",Five
Meternity,"₹4,575.90",Three
Memoirs of a Geisha,"₹5,215.35",Three
Like Never Before (Walker Family #2),"₹3,020.85",Two
Life of Pi,"₹1,388.10",Four
Leave This Song Behind: Teen Poetry at Its Best,"₹5,372.85",Five
King's Folly (The Kinsman Chronicles #1),"₹4,159.05",Five
John Adams,"₹6,030.15",Four
How to Cook Everything Vegetarian: Simple Meatless Recipes for Great Food (How to Cook Everything),"₹4,831.05",Four
How to Be a Domestic Goddess: Baking and the Art of Comfort Cooking,"₹2,966.25",Two
Good in Bed (Cannie Shapiro #1),"₹3,890.25",Five
"Fruits Basket, Vol. 7 (Fruits Basket #7)","₹2,054.85",One
For the Love: Fighting for Grace in a World of Impossible Standards,"₹4,738.65",Three
Finding God in the Ruins: How God Redeems Pain,"₹4,897.20",Two
Every Heart a Doorway (Every Heart A Doorway #1),"₹1,276.80",Five
Delivering the Truth (Quaker Midwife Mystery #1),"₹2,193.45",Four
Counted With the Stars (Out from Egypt #1),"₹1,886.85",Five
"Chronicles, Vol. 1","₹5,523.00",Two
Blue Like Jazz: Nonreligious Thoughts on Christian Spirituality,"₹2,705.85",One
Benjamin Franklin: An American Life,"₹5,059.95",Three
"At The Existentialist CafÃ©: Freedom, Being, and apricot cocktails with: Jean-Paul Sartre, Simone de Beauvoir, Albert Camus, Martin Heidegger, Edmund Husserl, Karl Jaspers, Maurice Merleau-Ponty and others","₹3,142.65",Five
A Summer In Europe,"₹4,655.70",Two
A Short History of Nearly Everything,"₹5,502.00",Five
A Gathering of Shadows (Shades of Magic #2),"₹4,705.05",Four
The Sound Of Love,"₹6,073.20",Five
The Rise and Fall of the Third Reich: A History of Nazi Germany,"₹4,165.35",Two
The Perks of Being a Wallflower,"₹5,777.10",Three
The Mysterious Affair at Styles (Hercule Poirot #1),"₹2,604.00",Four
The Man Who Mistook His Wife for a Hat and Other Clinical Tales,"₹6,242.25",Four
The Makings of a Fatherless Child,"₹3,315.90",Two
The Joy of Cooking,"₹4,543.35",Four
The Invention of Wings,"₹3,920.70",One
The Hobbit (Middle-Earth Universe),"₹1,869.00",Five
The Great Railway Bazaar,"₹3,206.70",One
The Golden Compass (His Dark Materials #1),"₹1,970.85",One
The God Delusion,"₹4,919.25",Three
The Girl You Left Behind (The Girl You Left Behind #1),"₹1,657.95",One
The Fellowship of the Ring (The Lord of the Rings #1),"₹1,078.35",Two
The Collected Poems of W.B. Yeats (The Collected Works of W.B. Yeats #1),"₹1,619.10",Five
The Barefoot Contessa Cookbook,"₹6,291.60",Five
Tell the Wolves I'm Home,"₹5,350.80",Two
Ship Leaves Harbor: Essays on Travel by a Recovering Journeyman,"₹3,213.00",Three
Pride and Prejudice,"₹2,023.35",Four
Musicophilia: Tales of Music and the Brain,"₹4,890.90",One
Mere Christianity,"₹5,093.55",Three
Me Before You (Me Before You #1),"₹1,997.10",One
In the Woods (Dublin Murder Squad #1),"₹4,029.90",Two
In Cold Blood,"₹5,247.90",Four
How to Stop Worrying and Start Living,"₹4,881.45",Five
Give It Back,"₹1,923.60",Two
"Girl, Interrupted","₹4,424.70",Three
Fun Home: A Family Tragicomic,"₹5,941.95",Four
"Fruits Basket, Vol. 6 (Fruits Basket #6)","₹2,200.80",Four
Deception Point,"₹4,233.60",Four
"Death Note, Vol. 6: Give-and-Take (Death Note #6)","₹3,820.95",Three
Catherine the Great: Portrait of a Woman,"₹6,147.75",Four
Better Homes and Gardens New Cook Book,"₹4,159.05",Three
An Unquiet Mind: A Memoir of Moods and Madness,"₹2,236.50",Three
A Year in Provence (Provence #1),"₹5,972.40",Four
World Without End (The Pillars of the Earth #2),"₹3,461.85",Four
"Will Grayson, Will Grayson (Will Grayson, Will Grayson)","₹4,967.55",Four
Why Save the Bankers?: And Other Essays on Our Economic and Political Crisis,"₹5,110.35",Two
Where She Went (If I Stay #2),"₹4,381.65",Four
What If?: Serious Scientific Answers to Absurd Hypothetical Questions,"₹5,636.40",Four
Two Summers,"₹1,537.20",One
This Is Your Brain on Music: The Science of a Human Obsession,"₹4,032.00",One
The Secret Garden,"₹1,583.40",Four
The Raven King (The Raven Cycle #4),"₹3,209.85",Two
The Raven Boys (The Raven Cycle #1),"₹6,062.70",Four
The Power Greens Cookbook: 140 Delicious Superfood Recipes,"₹1,160.25",Five
The Metamorphosis,"₹3,000.90",One
The Mathews Men: Seven Brothers and the War Against Hitler's U-boats,"₹4,505.55",Five
The Little Paris Bookshop,"₹2,596.65",Three
The Hiding Place,"₹5,870.55",Four
The Grand Design,"₹1,444.80",Three
The Firm,"₹4,783.80",Three
The Fault in Our Stars,"₹4,958.10",One
The False Prince (The Ascendance Trilogy #1),"₹5,880.00",Five
The Expatriates,"₹4,680.90",Two
The Dream Thieves (The Raven Cycle #2),"₹3,622.50",One
The Darkest Corners,"₹1,189.65",Five
The Crossover,"₹4,070.85",Four
The 5th Wave (The 5th Wave #1),"₹1,242.15",Two
Tell the Wind and Fire,"₹4,778.55",Three
Tell Me Three Things,"₹4,390.05",One
Talking to Girls About Duran Duran: One Young Man's Quest for True Love and a Cooler Haircut,"₹2,640.75",Four
Siddhartha,"₹3,593.10",Five
Shiver (The Wolves of Mercy Falls #1),"₹1,704.15",Five
Remember Me?,"₹1,205.40",Three
Red Dragon (Hannibal Lecter #1),"₹2,453.85",Three
Peak: Secrets from the New Science of Expertise,"₹1,709.40",Two
My Mother Was Nuts,"₹3,321.15",Four
Mexican Today: New and Rediscovered Recipes for Contemporary Kitchens,"₹2,615.55",Five
Maybe Something Beautiful: How Art Transformed a Neighborhood,"₹2,366.70",One
Lola and the Boy Next Door (Anna and the French Kiss #2),"₹2,481.15",Four
Logan Kade (Fallen Crest High #5.5),"₹1,377.60",Two
Last One Home (New Beginnings #1),"₹6,297.90",Three
Killing Floor (Jack Reacher #1),"₹3,306.45",Four
Kill the Boy Band,"₹1,629.60",Five
Isla and the Happily Ever After (Anna and the French Kiss #3),"₹5,053.65",Five
If I Stay (If I Stay #1),"₹4,003.65",Five
I Know Why the Caged Bird Sings (Maya Angelou's Autobiography #1),"₹3,837.75",Two
Harry Potter and the Deathly Hallows (Harry Potter #7),"₹2,448.60",One
"Fruits Basket, Vol. 5 (Fruits Basket #5)","₹1,714.65",One
Foundation (Foundation (Publication Order) #1),"₹3,404.10",One
Fool Me Once,"₹1,780.80",One
Find Her (Detective D.D. Warren #8),"₹2,348.85",One
Evicted: Poverty and Profit in the American City,"₹4,438.35",One
Drama,"₹4,063.50",Two
Dracula the Un-Dead,"₹3,741.15",Five
Digital Fortress,"₹6,090.00",Five
"Death Note, Vol. 5: Whiteout (Death Note #5)","₹5,503.05",One
"Data, A Love Story: How I Gamed Online Dating to Meet My Match","₹3,396.75",Three
Critique of Pure Reason,"₹2,178.75",One
Booked,"₹1,836.45",Five
"Blue Lily, Lily Blue (The Raven Cycle #3)","₹3,583.65",Five
Approval Junkie: Adventures in Caring Too Much,"₹6,175.05",Five
An Abundance of Katherines,"₹1,050.00",Five
America's War for the Greater Middle East: A Military History,"₹5,378.10",Two
Alight (The Generations Trilogy #2),"₹6,151.95",Four
A Girl's Guide to Moving On (New Beginnings #2),"₹3,286.50",One
A Game of Thrones (A Song of Ice and Fire #1),"₹4,874.10",Two
A Feast for Crows (A Song of Ice and Fire #4),"₹1,807.05",Four
A Clash of Kings (A Song of Ice and Fire #2),"₹1,132.95",Three
Vogue Colors A to Z: A Fashion Coloring Book,"₹5,496.75",Four
The Shining (The Shining #1),"₹2,927.40",Three
The Pilgrim's Progress,"₹5,277.30",Two
The Perfect Play (Play by Play #1),"₹6,298.95",Three
The Passion of Dolssa,"₹2,973.60",Five
The Jazz of Physics: The Secret Link Between Music and the Structure of the Universe,"₹4,064.55",Three
The Hunger Games (The Hunger Games #1),"₹3,134.25",Five
The Hound of the Baskervilles (Sherlock Holmes #5),"₹1,556.10",Two
The Gunning of America: Business and the Making of American Gun Culture,"₹1,765.05",Four
The Geography of Bliss: One Grump's Search for the Happiest Places in the World,"₹2,964.15",Two
The Demonists (Demonist #1),"₹5,471.55",Two
"The Demon Prince of Momochi House, Vol. 4 (The Demon Prince of Momochi House #4)","₹2,927.40",Two
The Bone Hunters (Lexy Vaughan & Steven Macaulay #2),"₹6,269.55",Three
The Beast (Black Dagger Brotherhood #14),"₹4,838.40",Five
Some Women,"₹1,441.65",Five
Shopaholic Ties the Knot (Shopaholic #3),"₹5,080.95",Five
Paper and Fire (The Great Library #2),"₹5,192.25",Five
Outlander (Outlander #1),"₹2,065.35",Five
"Orchestra of Exiles: The Story of Bronislaw Huberman, the Israel Philharmonic, and the One Thousand Jews He Saved from Nazi Horrors","₹1,297.80",Three
No One Here Gets Out Alive,"₹2,102.10",Five
Night Shift (Night Shift #1-20),"₹1,338.75",Four
Needful Things,"₹4,988.55",Four
Mockingjay (The Hunger Games #3),"₹2,146.20",Four
Misery,"₹3,652.95",Two
Little Women (Little Women #1),"₹2,947.35",Four
It,"₹2,626.05",Three
Harry Potter and the Sorcerer's Stone (Harry Potter #1),"₹1,459.50",Three
Harry Potter and the Prisoner of Azkaban (Harry Potter #3),"₹2,537.85",Four
Harry Potter and the Order of the Phoenix (Harry Potter #5),"₹3,321.15",Four
Harry Potter and the Half-Blood Prince (Harry Potter #6),"₹5,118.75",Five
Harry Potter and the Chamber of Secrets (Harry Potter #2),"₹1,547.70",One
Gone with the Wind,"₹3,411.45",Three
God Is Not Great: How Religion Poisons Everything,"₹2,919.00",One
Girl With a Pearl Earring,"₹2,810.85",One
"Fruits Basket, Vol. 4 (Fruits Basket #4)","₹5,296.20",Four
Far From True (Promise Falls Trilogy #2),"₹3,667.65",Two
Dark Lover (Black Dagger Brotherhood #1),"₹1,351.35",One
Confessions of a Shopaholic (Shopaholic #1),"₹5,138.70",Two
Changing the Game (Play by Play #2),"₹1,404.90",Three
Candide,"₹6,156.15",Three
Can You Keep a Secret?,"₹2,303.70",One
Atlas Shrugged,"₹2,790.90",Five
Animal Farm,"₹6,008.10",Three
A Walk to Remember,"₹5,925.15",One
A New Earth: Awakening to Your Life's Purpose,"₹5,843.25",Five
"A History of God: The 4,000-Year Quest of Judaism, Christianity, and Islam","₹2,900.10",One
'Salem's Lot,"₹5,203.80",Four
Zero History (Blue Ant #3),"₹3,650.85",One
Wuthering Heights,"₹1,861.65",Three
World War Z: An Oral History of the Zombie War,"₹2,289.00",One
Wild: From Lost to Found on the Pacific Crest Trail,"₹4,832.10",Three
"Where'd You Go, Bernadette","₹1,903.65",One
When You Are Engulfed in Flames,"₹3,243.45",Five
We the People: The Modern-Day Figures Who Have Reshaped and Affirmed the Founding Fathers' Vision of America,"₹3,354.75",Three
We Are All Completely Beside Ourselves,"₹2,524.20",One
Walk the Edge (Thunder Road #2),"₹3,397.80",Three
Voyager (Outlander #3),"₹2,212.35",Five
Very Good Lives: The Fringe Benefits of Failure and the Importance of Imagination,"₹5,319.30",Three
Vegan Vegetarian Omnivore: Dinner for Everyone at the Table,"₹1,434.30",Two
"Unstuffed: Decluttering Your Home, Mind, and Soul","₹6,099.45",One
Under the Banner of Heaven: A Story of Violent Faith,"₹3,150.00",One
Two Boys Kissing,"₹3,437.70",Two
Twilight (Twilight #1),"₹4,402.65",Two
Twenties Girl,"₹4,494.00",Two
"Trespassing Across America: One Man's Epic, Never-Done-Before (and Sort of Illegal) Hike Across the Heartland","₹5,618.55",One
Three-Martini Lunch,"₹2,437.05",Three
"Thinking, Fast and Slow","₹2,219.70",One
The Wild Robot,"₹5,887.35",Three
"The Wicked + The Divine, Vol. 3: Commercial Suicide (The Wicked + The Divine)","₹1,513.05",Three
The Undomestic Goddess,"₹4,803.75",Four
The Travelers,"₹1,655.85",One
The Tipping Point: How Little Things Can Make a Big Difference,"₹1,052.10",Two
The Thing About Jellyfish,"₹5,120.85",One
The Stand,"₹6,075.30",Two
The Smitten Kitchen Cookbook,"₹2,476.95",One
The Silkworm (Cormoran Strike #2),"₹2,420.25",Five
"The Sandman, Vol. 3: Dream Country (The Sandman (volumes) #3)","₹5,832.75",Five
The Rose & the Dagger (The Wrath and the Dawn #2),"₹6,157.20",Four
The Road to Little Dribbling: Adventures of an American in Britain (Notes From a Small Island #2),"₹2,437.05",One
The Rise of Theodore Roosevelt (Theodore Roosevelt #1),"₹4,469.85",Three
The Restaurant at the End of the Universe (Hitchhiker's Guide to the Galaxy #2),"₹1,146.60",One
The Rest Is Noise: Listening to the Twentieth Century,"₹3,650.85",One
The Red Tent,"₹3,744.30",Five
The Purpose Driven Life: What on Earth Am I Here for?,"₹3,904.95",Three
The Purest Hook (Second Circle Tattoos #3),"₹1,286.25",One
The Picture of Dorian Gray,"₹3,118.50",Two
The Paris Wife,"₹3,864.00",Three
The Obsession,"₹4,770.15",One
The Nightingale,"₹2,757.30",Four
The New Guy (and Other Senior Year Distractions),"₹4,716.60",Three
The Nanny Diaries (Nanny #1),"₹5,515.65",Five
The Name of God is Mercy,"₹3,911.25",Two
The Maze Runner (The Maze Runner #1),"₹2,197.65",One
The Lover's Dictionary,"₹6,099.45",Two
The Lonely Ones,"₹4,576.95",Five
The Lean Startup: How Today's Entrepreneurs Use Continuous Innovation to Create Radically Successful Businesses,"₹3,561.60",Three
The Last Painting of Sara de Vos,"₹5,832.75",Two
"The Land of 10,000 Madonnas","₹3,112.20",Four
The Infinities,"₹2,878.05",One
The Husband's Secret,"₹5,513.55",Five
The Hitchhiker's Guide to the Galaxy (Hitchhiker's Guide to the Galaxy #1),"₹5,019.00",Three
The Guns of August,"₹1,526.70",Two
The Guernsey Literary and Potato Peel Pie Society,"₹5,200.65",One
The Goldfinch,"₹4,575.90",Three
The Giver (The Giver Quartet #1),"₹1,291.50",One
The Girl with All the Gifts,"₹5,194.35",Three
The Girl Who Played with Fire (Millennium Trilogy #2),"₹2,324.70",Two
The Girl Who Kicked the Hornet's Nest (Millennium Trilogy #3),"₹6,035.40",One
The Exiled,"₹4,562.25",Three
"The End of Faith: Religion, Terror, and the Future of Reason","₹2,323.65",Four
"The Elegant Universe: Superstrings, Hidden Dimensions, and the Quest for the Ultimate Theory","₹1,368.15",Four
"The Disappearing Spoon: And Other True Tales of Madness, Love, and the History of the World from the Periodic Table of the Elements","₹6,021.75",Five
The Devil Wears Prada (The Devil Wears Prada #1),"₹4,650.45",One
The Demon-Haunted World: Science as a Candle in the Dark,"₹5,486.25",Four
The Day the Crayons Came Home (Crayons),"₹2,764.65",Five
The Da Vinci Code (Robert Langdon #2),"₹2,410.80",Two
The Cuckoo's Calling (Cormoran Strike #1),"₹2,017.05",One
The Complete Stories and Poems (The Works of Edgar Allan Poe [Cameo Edition]),"₹2,811.90",Four
The Complete Poems,"₹4,338.60",Five
The Catcher in the Rye,"₹2,577.75",One
The Cat in the Hat (Beginner Books B-1),"₹1,707.30",Two
The Case for Christ (Cases for Christianity),"₹5,023.20",One
The Book Thief,"₹5,616.45",Two
The Book of Basketball: The NBA According to The Sports Guy,"₹4,708.20",Five
The Blind Side: Evolution of a Game,"₹5,639.55",Five
The Autobiography of Malcolm X,"₹2,460.15",Two
"The Art of Simple Food: Notes, Lessons, and Recipes from a Delicious Revolution","₹3,603.60",Three
The Art of Fielding,"₹2,320.50",One
"Surely You're Joking, Mr. Feynman!: Adventures of a Curious Character","₹2,712.15",Two
Stiff: The Curious Lives of Human Cadavers,"₹3,857.70",Three
Spilled Milk: Based on a True Story,"₹5,198.55",One
Something Borrowed (Darcy & Rachel #1),"₹5,140.80",Five
Something Blue (Darcy & Rachel #2),"₹5,735.10",One
Soldier (Talon #3),"₹2,595.60",Two
Shopaholic & Baby (Shopaholic #5),"₹4,877.25",Two
Seven Days in the Art World,"₹5,494.65",Two
Seven Brief Lessons on Physics,"₹3,213.00",Four
Scarlet (The Lunar Chronicles #2),"₹1,529.85",Four
Sarah's Key,"₹4,860.45",One
"Saga, Volume 3 (Saga (Collected Editions) #3)","₹2,264.85",Five
Running with Scissors,"₹1,355.55",Four
Rogue Lawyer (Rogue Lawyer #1),"₹5,261.55",Three
"Rise of the Rocket Girls: The Women Who Propelled Us, from Missiles to the Moon to Mars","₹4,375.35",Four
Rework,"₹4,712.40",Two
Reservations for Two,"₹1,165.50",Three
Red: The True Story of Red Riding Hood,"₹2,996.70",Three
Ready Player One,"₹2,002.35",Four
Quiet: The Power of Introverts in a World That Can't Stop Talking,"₹4,572.75",One
Prodigy: The Graphic Novel (Legend: The Graphic Novel #2),"₹4,581.15",Three
Persepolis: The Story of a Childhood (Persepolis #1-2),"₹4,108.65",One
Packing for Mars: The Curious Science of Life in the Void,"₹5,951.40",Two
Outliers: The Story of Success,"₹1,486.80",One
Original Fake,"₹3,302.25",Three
Orange Is the New Black,"₹2,584.05",Two
One for the Money (Stephanie Plum #1),"₹3,451.35",Two
Notes from a Small Island (Notes From a Small Island #1),"₹4,217.85",One
Night (The Night Trilogy #1),"₹1,418.55",One
Neither Here nor There: Travels in Europe,"₹4,089.75",Three
Naked,"₹3,327.45",Three
Morning Star (Red Rising #3),"₹3,087.00",One
"Miracles from Heaven: A Little Girl, Her Journey to Heaven, and Her Amazing Story of Healing","₹6,072.15",One
Midnight Riot (Peter Grant/ Rivers of London - books #1),"₹5,823.30",Two
Me Talk Pretty One Day,"₹6,048.00",Two
Manuscript Found in Accra,"₹3,672.90",Two
Lust & Wonder,"₹1,246.35",Two
Lila (Gilead #3),"₹1,309.35",Three
"Life, the Universe and Everything (Hitchhiker's Guide to the Galaxy #3)","₹3,492.30",Two
Life Without a Recipe,"₹6,199.20",Five
Life After Life,"₹2,743.65",Two
Letter to a Christian Nation,"₹2,331.00",One
Let's Pretend This Never Happened: A Mostly True Memoir,"₹4,736.55",One
Legend (Legend #1),"₹4,587.45",Four
"Lean In: Women, Work, and the Will to Lead","₹2,627.10",One
"Lamb: The Gospel According to Biff, Christ's Childhood Pal","₹5,827.50",Five
Lady Renegades (Rebel Belle #3),"₹5,569.20",Five
Jurassic Park (Jurassic Park #1),"₹4,721.85",One
It's Never Too Late to Begin Again: Discovering Creativity and Meaning at Midlife and Beyond,"₹4,449.90",One
Is Everyone Hanging Out Without Me? (And Other Concerns),"₹2,111.55",Three
Into the Wild,"₹5,953.50",Five
Inferno (Robert Langdon #4),"₹4,305.00",Five
"In the Garden of Beasts: Love, Terror, and an American Family in Hitler's Berlin","₹3,029.25",Three
If I Run (If I Run #1),"₹5,246.85",Four
I've Got Your Number,"₹2,067.45",One
I Am Malala: The Girl Who Stood Up for Education and Was Shot by the Taliban,"₹3,032.40",Two
Hungry Girl Clean & Hungry: Easy All-Natural Recipes for Healthy Eating in the Real World,"₹3,479.70",Three
"House of Lost Worlds: Dinosaurs, Dynasties, and the Story of Life on Earth","₹4,588.50",Two
House of Leaves,"₹5,763.45",One
Horrible Bear!,"₹3,939.60",Two
Holidays on Ice,"₹5,362.35",Two
Heir to the Sky,"₹4,627.35",Four
Green Eggs and Ham (Beginner Books B-16),"₹1,132.95",Four
"Grayson, Vol 3: Nemesis (Grayson #3)","₹4,485.60",One
Gratitude,"₹2,799.30",Five
Gone Girl,"₹3,948.00",Five
Golden (Heart of Dread #3),"₹4,432.05",Four
Girl in the Blue Coat,"₹4,917.15",Two
"Fruits Basket, Vol. 3 (Fruits Basket #3)","₹4,742.85",Two
"Friday Night Lights: A Town, a Team, and a Dream","₹5,378.10",Three
Fire Bound (Sea Haven/Sisters of the Heart #5),"₹2,234.40",Four
Fifty Shades Freed (Fifty Shades #3),"₹1,612.80",Five
Fellside,"₹4,055.10",One
Extreme Prey (Lucas Davenport #26),"₹2,667.00",Three
Eragon (The Inheritance Cycle #1),"₹4,606.35",Three
Eclipse (Twilight #3),"₹1,967.70",One
Dune (Dune #1),"₹5,760.30",One
Dracula,"₹5,525.10",Three
Do Androids Dream of Electric Sheep? (Blade Runner #1),"₹5,405.40",One
Disrupted: My Misadventure in the Start-Up Bubble,"₹1,604.40",Five
Dead Wake: The Last Crossing of the Lusitania,"₹4,120.20",Five
"David and Goliath: Underdogs, Misfits, and the Art of Battling Giants","₹1,870.05",One
Darkfever (Fever #1),"₹5,882.10",One
Dark Places,"₹2,509.50",Five
Crazy Rich Asians (Crazy Rich Asians #1),"₹5,158.65",Five
Counting Thyme,"₹1,115.10",One
Cosmos,"₹3,797.85",Two
